### ISSUE TITLE
DataDog agent tries to reach 100.100.100.200:80 every half hour relative to process start time

### ISSUE THREAD

**Issue by dcieslak** [DataDog/datadog-agent#9316]
**Output of the info page (if this is a bug)**
```
$ sudo service datadog-agent status
Redirecting to /bin/systemctl status datadog-agent.service
● datadog-agent.service - Datadog Agent
   Loaded: loaded (/usr/lib/systemd/system/datadog-agent.service; enabled; vendor preset: disabled)
   Active: active (running) since pon 2021-09-20 14:48:30 CEST; 1 weeks 2 days ago
 Main PID: 22747 (agent)
    Tasks: 13
   Memory: 89.7M
   CGroup: /system.slice/datadog-agent.service
           └─22747 /opt/datadog-agent/bin/agent/agent run -p /opt/datadog-agent/run/agent.pid

wrz 30 11:04:10 ETCD2 agent[22747]: 2021-09-30 11:04:10 CEST | CORE | WARN | (pkg/collector/python/datadog_agent.go:124 in LogMessage) | disk:e5dffb8bef24336f | (disk.py:137) | Unable to get disk metrics for /run/docker/netns/5911808fa4...
wrz 30 11:04:10 ETCD2 agent[22747]: 2021-09-30 11:04:10 CEST | CORE | WARN | (pkg/collector/python/datadog_agent.go:124 in LogMessage) | disk:e5dffb8bef24336f | (disk.py:137) | Unable to get disk metrics for /run/docker/netns/b7f67ca60c...
wrz 30 11:04:10 ETCD2 agent[22747]: 2021-09-30 11:04:10 CEST | CORE | WARN | (pkg/collector/python/datadog_agent.go:124 in LogMessage) | disk:e5dffb8bef24336f | (disk.py:137) | Unable to get disk metrics for /run/docker/netns/7ca4d37d26...
wrz 30 11:04:10 ETCD2 agent[22747]: 2021-09-30 11:04:10 CEST | CORE | WARN | (pkg/collector/python/datadog_agent.go:124 in LogMessage) | disk:e5dffb8bef24336f | (disk.py:137) | Unable to get disk metrics for /run/docker/netns/ddea9ee478...
wrz 30 11:04:10 ETCD2 agent[22747]: 2021-09-30 11:04:10 CEST | CORE | WARN | (pkg/collector/python/datadog_agent.go:124 in LogMessage) | disk:e5dffb8bef24336f | (disk.py:137) | Unable to get disk metrics for /run/docker/netns/966b37bf4b...
wrz 30 11:04:10 ETCD2 agent[22747]: 2021-09-30 11:04:10 CEST | CORE | WARN | (pkg/collector/python/datadog_agent.go:124 in LogMessage) | disk:e5dffb8bef24336f | (disk.py:137) | Unable to get disk metrics for /run/docker/netns/ee81daecd6...
wrz 30 11:04:10 ETCD2 agent[22747]: 2021-09-30 11:04:10 CEST | CORE | WARN | (pkg/collector/python/datadog_agent.go:124 in LogMessage) | disk:e5dffb8bef24336f | (disk.py:137) | Unable to get disk metrics for /run/docker/netns/3e5fd6f0b0...
wrz 30 11:04:10 ETCD2 agent[22747]: 2021-09-30 11:04:10 CEST | CORE | WARN | (pkg/collector/python/datadog_agent.go:124 in LogMessage) | disk:e5dffb8bef24336f | (disk.py:137) | Unable to get disk metrics for /run/docker/netns/17b30cdd65...
wrz 30 11:04:19 ETCD2 agent[22747]: 2021-09-30 11:04:19 CEST | CORE | ERROR | (pkg/collector/worker/check_logger.go:68 in Error) | check:coredns | Error running check: [{"message": "HTTPConnectionPool(host='10.196.0.2'....connection.HTTPCo
wrz 30 11:04:20 ETCD2 agent[22747]: 2021-09-30 11:04:20 CEST | CORE | INFO | (cmd/agent/api/agent/agent.go:174 in getStatus) | Got a request for the status. Making status.
Hint: Some lines were ellipsized, use -l to show in full.
```

**Describe what happened:**

DataDog agent tries to reach 100.100.100.200:80 every half hour (and gets TCP RST):

```
07:22:17.746334 IP ETCD1.35558 > 100.100.100.200.http: Flags [S], seq 1825989842, win 29200, options [mss 1460,sackOK,TS val 593661638 ecr 0,nop,wscale 7], length 0
07:22:17.746712 IP 100.100.100.200.http > ETCD1.35558: Flags [R.], seq 421194234, ack 1825989843, win 29200, length 0
07:52:17.748222 IP ETCD1.39392 > 100.100.100.200.http: Flags [S], seq 938670507, win 29200, options [mss 1460,sackOK,TS val 595461640 ecr 0,nop,wscale 7], length 0
07:52:17.748604 IP 100.100.100.200.http > ETCD1.39392: Flags [R.], seq 1493925261, ack 938670508, win 29200, length 0
```

relative to process start time:

```
$ systemctl show datadog-agent | grep ExecMainStartTimestamp=
ExecMainStartTimestamp=pon 2021-09-20 14:22:06 CEST
```

**Describe what you expected:**

No spurious calls that raise warnings in network team.

**Steps to reproduce the issue:**

Start the datadog.

```sudo tcpdump -i any host 100.100.100.200```

wait for half hour to see packets from datadog.

**Additional environment details (Operating System, Cloud provider, etc):**

CentOS Linux release 7.9.2009 (Core)

**Comment by olivielpeau** [comment]
Hi @dcieslak, these network calls to `100.100.100.200` are made by the agent to try to reach known internal metadata services of cloud providers (in this case, Alibaba Cloud). You can disable this by explicitly restricting the list of cloud provider metadata services the agent will try to reach with the `cloud_provider_metadata` agent-level option (documented in the config template [here](https://github.com/DataDog/datadog-agent/blob/0cc10ea98cbb661008fb6a1e21f3a2b6b6b14132/pkg/config/config_template.yaml#L259-L280)).

I'll go ahead and close this issue, but feel free to comment here if you have further questions.

**Comment by dcieslak** [comment]
Actually, making the list empty hasn't helped. Cloud specific hosts were still tried. By analyzing your probe source code:

https://github.com/DataDog/datadog-agent/blob/ed956b50684785650bcfda01041833d62672a594/pkg/config/config.go#L1035

I've found proper solution:

```
use_proxy_for_cloud_metadata: true
```

With that setting 100.100.100.200 is not checked every half hour.

**Comment by olivielpeau** [comment]
Setting `use_proxy_for_cloud_metadata` to `true` should only make the agent use the system- or agent-configured proxy when trying to reach cloud-provider hosts.

If this is not the behavior you noticed, feel free to [send a flare](https://docs.datadoghq.com/agent/troubleshooting/send_a_flare/?tab=agentv6v7) to our support team, and we can continue the investigation there (with the additional config context captured in the flare).

**Comment by jurschel** [comment]
How can I stop this from happening while using the helm chart install?  I just enabled NPM and I don't need this traffic confusing people.
